{
  "schema_version": "0.1",
  "benchmark_session_id": "BMS-SYNTHETIC-001",
  "session_id": "BMS-SESSION-SYNTHETIC-001",
  "dataset_type": "synthetic",
  "synthetic_status": "synthetic_only",
  "benchmark_scope": "dyadic_session_helper",
  "benchmark_stage": "P3_public_synthetic",
  "session_type": "synthetic_benchmark_session",
  "participant_scope": "synthetic_dyad",
  "modality_stack": [
    "mock_human_state_packet",
    "mock_dyadic_delta",
    "mock_recovery_gate",
    "mock_termination_gate",
    "synthetic_turn_taking",
    "synthetic_voice_proxy"
  ],
  "event_schema_ref": "schemas/dyadic_session_event.schema.json",
  "session_event_refs": [
    "DSE-SYNTHETIC-001"
  ],
  "baseline_suite_status": "declared",
  "baseline_suite_version": "v0.1",
  "primary_outcome": "dyadic_recovery_delta",
  "human_state_delta_summary": "mixed",
  "dyadic_delta_summary": "dyad_mixed",
  "recovery_gate_summary": "recovery_uncertain",
  "termination_gate_summary": "pause_required",
  "leakage_review_status": "passed_with_notes",
  "holdout_strategy": "synthetic_session_holdout_demo",
  "data_boundary_status": "synthetic_only",
  "consent_boundary_status": "consent_confirmed",
  "sharing_boundary_status": "synthetic_public_example_only",
  "audit_status": "audit_present",
  "public_release_status": "public_synthetic_only",
  "authority_status": "github_helper_only",
  "boundary_flags": {
    "raw_human_data_present": false,
    "identifiable_data_present": false,
    "clinical_data_present": false,
    "private_state_exposure_risk": false,
    "relationship_verdict_present": false,
    "human_score_present": false,
    "diagnostic_claim_present": false,
    "therapeutic_claim_present": false,
    "counseling_claim_present": false,
    "legal_mediation_claim_present": false,
    "surveillance_claim_present": false,
    "sal_meter_validation_claim_present": false,
    "cais_compliance_claim_present": false,
    "production_intervention_claim_present": false,
    "benchmark_validation_claim_present": false,
    "synthetic_public_data_confirmed": true,
    "audit_log_required": true
  },
  "final_boundary_status": "boundary_valid",
  "notes": "Synthetic benchmark session container only. No raw human data, no identifiable data, no clinical data, no Sal-Meter validation, no CAIS compliance, no benchmark validation, no mediation validation, and no production closed-loop claim."
}
